Book Id,Title,Author,Author l-f,Additional Authors,ISBN,ISBN13,My Rating,Average Rating,Publisher,Binding,Number of Pages,Year Published,Original Publication Year,Date Read,Date Added,Bookshelves,Bookshelves with positions,Exclusive Shelf,My Review,Spoiler,Private Notes,Read Count,Owned Copies
145092772,Центр тяжести (Russian Edition),Alexey Polyarinov,"Polyarinov, Alexey",Алексей Поляринов,"=""5001399610""","=""9785001399612""",5,4.27,Альпина нон-фикшн,Kindle Edition,580,2023,,2024/05/26,2024/05/21,,,read,"Теперь это точно моя любимая книга Поляринова.<br/><br/>Как бы рассказать об этом произведение.<br/>Это роман, но роман, который по ходу повествования меняет свой жанр. Сначала это такой роман взросления, с нотками подросткового детектива, но по мере этого самого взросления роман превращается в антиутопию, а местами в пов одного из героев это еще очень напоминает киберпанк. Со всем этим еще переплетаются сказки, которые начинаются еще в предисловии к новому изданию. И сказки эти, великолепно выстраиваются в само произведение. <br/>Я бы хотела почитать всю книгу «Путешествие камней» Нины Ходжаровой.",,,1,0
53706432,Город женщин,Elizabeth Gilbert,"Gilbert, Elizabeth",Юлия Змеева,"=""""","=""""",4,4.04,,Kindle Edition,,2019,2019,2024/04/26,2024/04/21,,,read,,,,1,0
202268220,Дислексия,Светлана Олонцева,"Олонцева, Светлана",,"=""5605040219""","=""9785605040217""",4,4.12,Поляндрия NoAge,Paperback,256,2023,,2024/05/12,2024/05/11,,,read,"Авторка говорит, что это не автофикшн, но это очень похоже на него. Слог простой, книжка не большая и от этого читается быстро и легко.<br/>Интересная подача. От лица со стороны, которое мы так и <br/>не узнаем кем является, хоть и можно догадаться.<br/>Еще понравилось, что при чтение иногда кажется, что школа существует вне времени, и авторка переодически возвращает нас, что мы в начале 20-ых. ",,,1,0
122928388,Kids Run the Show,Delphine de Vigan,"Vigan, Delphine de",Alison Anderson,"=""1609459857""","=""9781609459857""",4,3.94,Europa Editions,Kindle Edition,285,2023,2021,2024/05/02,2024/05/02,,,read,"Первая часть (основаная «масса» произведения) - Захватывающий детектив, с достаточно тухлой развязкой, но это тот случай, когда ты радуешься, что она тухлая. Не ждешь тут серийных маньяков и насилия в привычном смысле слова. О, нет, тут насилие показано совсем с другой стороны.<br/><br/>Вторая часть  - кульминация, обсуждение и предположение, к чему приведет чрезмерное использование образа детей в сети с рождения. О необходимости юридической регулировки, о психологических последствиях и многом другом, о чем нам еще примется узнать как обществу ",,,1,0
59770756,Событие,Annie Ernaux,"Ernaux, Annie",Анни Эрно,"=""""","=""""",0,4.32,No kidding press,Paperback,79,2021,2000,2024/05/01,2023/11/29,,,read,,,,1,0
166997,Stoner,John  Williams,"Williams, John",John McGahern,"=""1590171993""","=""9781590171998""",0,4.34,New York Review Books,Paperback,292,2006,1965,,2024/05/01,to-read,to-read (#113),to-read,,,,0,0
197463244,"316, punkt ""V"": roman",Limonov Eduard Veniaminovich,"Veniaminovich, Limonov Eduard",,"=""5001396328""","=""9785001396321""",0,3.15,Alpina non-fikshn,Hardcover,276,2023,1998,2024/04/30,2024/04/08,,,read,,,,1,0
199368721,"Wild Love (Rose Hill, #1)",Elsie Silver,"Silver, Elsie",,"=""0349441626""","=""9780349441627""",0,4.07,Piatkus,Kindle Edition,402,2024,2024,,2024/04/22,to-read,to-read (#112),to-read,,,,0,0
61269012,Лисьи броды,Anna Starobinets,"Starobinets, Anna",Анна Старобинец,"=""5386147005""","=""9785386147006""",5,4.21,Рипол-Классик,Hardcover,720,2022,,2023/01/18,2023/01/08,,,read,,,,2,0
209288912,Кадавры,Alexey Polyarinov,"Polyarinov, Alexey",Алексей Поляринов,"=""504195870X""","=""9785041958701""",0,4.06,Inspiria,Hardcover,288,2024,2024,2024/04/08,2024/03/29,audio,audio (#5),read,,,,1,0
49466262,Bohemian,Kathryn  Nolan,"Nolan, Kathryn",,"=""""","=""""",0,4.15,"That's What She Said Publishing, Inc.",Kindle Edition,308,2019,2017,,2024/04/11,to-read,to-read (#111),to-read,,,,0,0
42036538,"Gideon the Ninth (The Locked Tomb, #1)",Tamsyn Muir,"Muir, Tamsyn",,"=""1250313198""","=""9781250313195""",0,4.21,Tor,Hardcover,448,2019,2019,,2024/04/10,to-read,to-read (#110),to-read,,,,0,0
62562896,Old Enough,Haley Jakobson,"Jakobson, Haley",,"=""0593473000""","=""9780593473009""",0,4.01,Dutton,Hardcover,336,2023,2023,,2024/04/10,to-read,to-read (#109),to-read,,,,0,0
56898297,Greedy: Notes from a Bisexual Who Wants Too Much,Jen Winston,"Winston, Jen",,"=""1982179171""","=""9781982179175""",0,3.93,Atria Books,Paperback,336,2021,2021,,2024/04/10,to-read,to-read (#108),to-read,,,,0,0
96177629,Good Material,Dolly Alderton,"Alderton, Dolly",,"=""0241523672""","=""9780241523674""",0,3.88,Fig Tree,Paperback,345,2023,2023,,2024/04/10,to-read,to-read (#107),to-read,,,,0,0
53915332,Gay Bar: Why We Went Out,Jeremy Atherton Lin,"Lin, Jeremy Atherton",,"=""0316458732""","=""9780316458733""",0,3.79,"Little, Brown and Company",Hardcover,320,2021,2021,,2024/04/10,to-read,to-read (#106),to-read,,,,0,0
55878999,"The Sunbearer Trials (The Sunbearer Duology, #1)",Aiden Thomas,"Thomas, Aiden",,"=""""","=""""",0,4.32,Feiwel & Friends,Kindle Edition,352,2022,2022,,2024/04/10,to-read,to-read (#105),to-read,,,,0,0
23309634,Before We Were Strangers,Renee Carlino,"Carlino, Renee",,"=""1501105779""","=""9781501105777""",0,4.07,Atria Books,Paperback,310,2015,2015,,2024/04/10,to-read,to-read (#104),to-read,,,,0,0
58516665,Write Me Off,Brandy  Davis,"Davis, Brandy",,"=""1737425971""","=""9781737425977""",0,4.02,,Kindle Edition,532,2021,,,2024/04/10,to-read,to-read (#103),to-read,,,,0,0
39336718,"Long Shot (Hoops, #1)",Kennedy Ryan,"Ryan, Kennedy",,"=""""","=""""",0,4.18,,Kindle Edition,462,2018,2018,,2024/04/10,to-read,to-read (#102),to-read,,,,0,0
21920615,Щегол,Donna Tartt,"Tartt, Donna","Донна Тартт, Анастасия Завозова","=""517085448X""","=""9785170854486""",0,3.95,Corpus,Hardcover,827,2014,2013,,2024/04/09,to-read,to-read (#101),to-read,,,,0,0
60291103,What the Heart Wants,Nikki Ash,"Ash, Nikki",,"=""""","=""""",0,3.94,,Kindle Edition,389,2023,,,2024/04/09,to-read,to-read (#100),to-read,,,,0,0
209167460,Двести третий день зимы,Ольга Птицева,"Птицева, Ольга",,"=""5605040243""","=""9785605040248""",0,4.12,Polyandria NoAge ,Hardcover,320,2024,,,2024/04/06,to-read,to-read (#99),to-read,,,,0,0
209847797,Наши бесконечные последние дни (Russian Edition),Клэр Фуллер,"Фуллер, Клэр",Иван Авраменко,"=""5001315662""","=""9785001315667""",0,4.38,Синдбад,Kindle Edition,300,2024,,,2024/04/06,to-read,to-read (#98),to-read,,,,0,0
56898248,"The Charm Offensive (The Charm Offensive, #1)",Alison Cochrun,"Cochrun, Alison",,"=""1982170719""","=""9781982170714""",5,4.12,Atria Books,Paperback,354,2021,2021,2024/04/05,2023/08/18,,,read,"О чем книга: Чарли приходил на реалити шоу (типо холостяка), чтобы исправить свой имидж, но оказывается к этому совсем не готов. Вылезти из скорлупы ему смог помочь только его продюсер Дэв. И хотя Чарли считает, что найти любовь на шоу невозможно, в реальности он сталкивается с обратным.<br/><br/>Это было очень мило и сладко, но так же с разрыванием сердца и страданием (такой коктейль я люблю).<br/>Борьба со стигмитизацией ментального здоровья и широкая репрезентация сделали свое дело. Мне правда это понравилось.<br/>Там еще поднимается проблема репрезентации, но тут я вот не уверена, что авторке стоило это делать. Потому что сама она с репрезентацией не справляется. <br/>(В Дэве индийского только имя и цвет кожи)<br/><br/>Поинты, что мне понравились:<br/>- ты достоин любви, не смотря на … все. Как романтической, так и платонической,<br/>- ты можешь говорить сколько угодно, что ты за прогрессивные взгляды, нанимать людей разной сексуальности и все еще оставаться гомофобкой. Так случилось тут с шоураннером. Угрожать выставить гг в плохом свете, если он не будет проталкивать ее гетеросексуальный нарратив, это просто ",,,1,0
58803433,Distrust (The Hallowed Crows MC #1),G.N. Wright,"Wright, G.N.",,"=""""","=""""",0,4.02,,Kindle Edition,259,2021,2021,,2024/04/02,to-read,to-read (#97),to-read,,,,0,0
193781998,The Husbands,Holly Gramazio,"Gramazio, Holly",,"=""0385550618""","=""9780385550611""",0,3.52,Doubleday,Hardcover,352,2024,2024,,2024/04/01,to-read,to-read (#96),to-read,,,,0,0
55200663,"The Darkness Outside Us (The Darkness Outside Us, #1)",Eliot Schrefer,"Schrefer, Eliot",,"=""0062888285""","=""9780062888280""",0,4.32,Katherine Tegen Books,Hardcover,397,2021,2021,,2024/03/31,to-read,to-read (#95),to-read,,,,0,0
121457838,Отец смотрит на запад (Russian Edition),Екатерина Манойло,"Манойло, Екатерина",,"=""5001398487""","=""9785001398486""",4,3.95,Альпина нон-фикшн,Kindle Edition,233,2022,,2024/03/31,2024/02/28,,,read,,,,1,0
58527403,"Magnolia Parks (Magnolia Parks Universe, #1)",Jessa Hastings,"Hastings, Jessa",,"=""1737281198""","=""9781737281191""",0,3.71,,Kindle Edition,423,2021,2021,,2024/03/31,to-read,to-read (#94),to-read,,,,0,0
53259689,Счастливые люди читают книжки и пьют кофе,Véronique Grisseaux,"Grisseaux, Véronique","Cécile Bidault, Agnès Martin-Lugand","=""5171173591""","=""9785171173593""",0,3.90,АСТ: Corpus,Hardcover,128,2020,2019,,2024/03/28,to-read,to-read (#93),to-read,,,,0,0
65137920,The Lost Bookshop,Evie  Woods,"Woods, Evie",Evie Gaughan,"=""0008609209""","=""9780008609207""",0,4.06,One More Chapter/HarperCollins UK,Kindle Edition,432,2023,2023,,2024/03/26,to-read,to-read (#92),to-read,,,,0,0
204979287,Дети в гараже моего папы,Анастасия Максимова,"Максимова, Анастасия",,"=""""","=""""",4,3.91,Альпина. Проза,Hardcover,248,2024,,2024/03/23,2024/03/21,,,read,"Даже не могу описать, чего мне не хватило до 5-ти звезд. <br/>Идея супер, на протяжение книги смотришь как разные люди справляются с горем, разным горем. Все поведение персонажей и развитие событий кажется очень логичным. Гг сопереживаешь. Скачек времени очень хорошо описан. От мыслей подростка до мыслей взрослого. <br/>Но вот чего-то все равно не хватило. Не оставила эта книга какого-то сильного впечатления, хотя кажется все в ней есть.<br/><br/>++ за цитату из Гарри Поттера ",,,1,0
52871061,"The Predator (Dark Verse, #1)",RuNyx,"RuNyx, RuNyx",,"=""""","=""""",0,4.00,,Paperback,318,2020,2020,,2024/03/21,to-read,to-read (#91),to-read,,,,0,0
10142996,Pleasures of the Night,Sylvia Day,"Day, Sylvia",,"=""0061749559""","=""9780061749551""",2,3.68,HarperCollins e-books,Kindle Edition,304,2009,2007,2024/03/21,2024/03/12,,,read,"Послушайте, идея хорошая, но на этом все.<br/><br/>Перевод, язык, повествование. Я терялось от чьего лица идет речь, что и почему происходит. И главное, книга не дает ответов на происходящие события. Там нет развязки, нет каких-то объяснений, она просто заканчивается ",,,1,0
62990658,For the Fans,Nyla K.,"K., Nyla",,"=""""","=""""",5,4.34,,Kindle Edition,546,2023,2023,2024/03/11,2024/02/09,,,read,,,,1,0
60695252,You & Me,Tal Bauer,"Bauer, Tal",,"=""""","=""""",5,4.47,,Kindle Edition,384,2022,2022,2024/03/05,2024/03/03,,,read,"So sweet, so kind, so romantic ❤️<br/>My heart melted for Luke and Landon, for their love to each other and to theirs sons! <br/>Great read to heal your soul",,,1,0
63121503,"Love & Monsters (Book Club Boys, #1)",Max  Walker,"Walker, Max",,"=""""","=""""",0,3.52,,Kindle Edition,304,2022,2023,,2024/03/04,to-read,to-read (#90),to-read,,,,0,0
55095657,"Баллада о змеях и певчих птицах (Голодные игры, #0)",Suzanne Collins,"Collins, Suzanne",Сьюзен Коллинз,"=""5171221189""","=""9785171221188""",0,3.97,АСТ,Hardcover,512,2020,2020,,2024/03/02,to-read,to-read (#89),to-read,,,,0,0
60173851,"Саша, привет!",Dmitry Danilov,"Danilov, Dmitry",Дмитрий Данилов,"=""5171463425""","=""9785171463427""",0,3.82,АСТ,Hardcover,256,2022,,,2024/02/28,to-read,to-read (#88),to-read,,,,0,0
60877616,"Really Good, Actually",Monica Heisey,"Heisey, Monica",,"=""0063235412""","=""9780063235410""",0,3.15,William Morrow,Hardcover,370,2023,2023,,2024/02/28,to-read,to-read (#87),to-read,,,,0,0
195469957,"Puck One Night Stands (Chicago Racketeers, #1)",Emma Foxx,"Foxx, Emma",,"=""""","=""""",0,3.86,"Blake Wilder Books, LLC",Kindle Edition,326,2023,,,2024/02/28,to-read,to-read (#86),to-read,,,,0,0
55228948,Риф,Alexey Polyarinov,"Polyarinov, Alexey",Алексей Поляринов,"=""5041099332""","=""9785041099336""",5,4.16,Эксмо,Hardcover,287,2020,2020,2024/02/28,2024/01/24,,,read,"Мне оооочень понравилось. В основном тем, что меня затянуло внутрь с первых страниц и так и не отпускало. Мне понравилась форма текста и как в него вплетены разные исследования.<br/>Рассказать о чем этот роман у меня без спойлеров не получится, но точно рекомендую",,,1,0
59516880,Quarterlife: The Search for Self in Early Adulthood,Satya Doyle Byock,"Byock, Satya Doyle",,"=""0525511660""","=""9780525511663""",0,4.01,Random House,Hardcover,240,2022,,,2024/02/26,to-read,to-read (#85),to-read,,,,0,0
30074769,"Passion (Priest, #1)",Sierra Simone,"Simone, Sierra",,"=""2811216898""","=""9782811216894""",2,3.58,Milady,Paperback,410,2016,2015,2024/02/26,2024/02/13,,,read,"Знаете что, если бы эта книга закончилась по-другому, если бы он правда понял, что был готов пожертвовать всем ради девушки, которую почти не знает, если бы начал жить дальше и весь рассказ это его «Исповедь» о прошлой жизни, я бы поставила даже три звезды.<br/>Но с таким концом, я еле-еле наскребла две<br/><br/>Сюжет в этой книге есть, но если убрать секс и страдания о выборе, останется страниц 10-15. И такие книжки имеют право быть, но на 6 подряд странице секса начинаешь уже скучать, даже если начиналось хорошо.<br/><br/>Еще автор священника выставляет ""хорошим парнем"", у него все эти тярзания и тд. поэтому когда просыпается его доминантная сторона, даже просто мысли (которых он вообще не стыдытся кстати, а кажется священнику не принято) это как будто детальки пазла не сходятся.<br/>если бы он был по умолчанию ""плохим парнем"", для меня было бы более органично и логично. Но это была бы совсем другая история ",,,1,0
142420787,Сообщники: Сборник рассказов (Вне серии) (Russian Edition),Евгения Некрасова,"Некрасова, Евгения","Анна Пестерева, Данхаяа Ховалыг, Сергей Лебеденко, Наташа Подлыжняк, Александра Бруй, Таня Климова, Аня Соболева, Денис Осокин, Света Лукьянова, Татьяна Юн, Надя Ершова, Кристина Гептинг, Денис Сорокотягин","=""500167476X""","=""9785001674764""",4,4.31,САМОКАТ,Kindle Edition,172,2023,,2024/02/23,2024/01/30,,,read,,,,1,0
10821000,The Locker Room,Amy Lane,"Lane, Amy",,"=""1613720122""","=""9781613720127""",4,4.11,Dreamspinner Press,ebook,250,2011,2011,2024/02/22,2024/02/22,,,read,"Это практически 5 звезд! Я сомневалась, но никак не смогла поставить 5, потому что мне НУЖЕН был эпилог. Мне нужно было знать, чем все закончилось. Да, я понимаю, что они вместе и это самое главное, но столько всего осталось за кадром. И я понимаю, что это специально. Но я весь день читала эту книжку, чтобы там все закончилось ХОРОШО, а получила открытый, хоть и счастливый конец ",,,1,0
106731858,(не)свобода,Сергей Лебеденко,"Лебеденко, Сергей",,"=""5171490406""","=""9785171490409""",5,3.78,АСТ: Редакция Елены Шубиной,Hardcover,412,2022,2022,2024/02/21,2024/02/17,audio,audio (#4),read,"Книга «(не)свобода» это художественное изложение дела Седьмой студии. <br/>Мне кажется, наличие множественных повов позволяют автору достаточно широко увидеть картинку. Мы ждём от судьи вовлечение в дело, а она тем временем думает успеет ли муж забрать сына из школы. Мы думаем, что перешли кому-то дорогу, а это все стечение обстоятельств. Какие же мелочи и человеческая блажь может испортить жизни многих людей.<br/>",,,1,0
205810705,"Loving the Legend (Chasing Rings, #1)",Kit Grey,"Grey, Kit",,"=""""","=""""",0,4.31,,Kindle Edition,488,2024,2024,,2024/02/22,to-read,to-read (#84),to-read,,,,0,0
63205620,Выше ноги от земли,Turbin Mihail,"Mihail, Turbin",,"=""5171503567""","=""9785171503567""",0,3.74,АСТ,Hardcover,317,2022,,,2024/02/15,to-read,to-read (#83),to-read,,,,0,0
8285896,Метель,Vladimir Sorokin,"Sorokin, Vladimir",,"=""5170658257""","=""9785170658251""",0,3.72,"АСТ, Астрель, Харвест",Hardcover,304,2010,2010,2024/02/13,2024/02/11,,,read,,,,1,0
201574045,"Rules of Our Own (Rule Breaker, #3)",Jessa Wilder,"Wilder, Jessa",,"=""""","=""""",0,3.98,Amazon Digital Services,Kindle Edition,508,2023,2023,,2024/02/12,to-read,to-read (#82),to-read,,,,0,0
62246585,Парень встретил парня,David Levithan,"Levithan, David",Дэвид Левитан,"=""""","=""""",3,3.81,Popcorn Books,Paperback,224,2022,2003,2024/02/09,2023/01/14,,,read,"Классический YA. Но то ли из-за перевода, то ли из-за стиля автора очень слабенький. «Галопом по Европам», наверно примерно так и  происходит в подростковой голове, но я прям чувствовала что текст «бежит».<br/><br/>А так, подростковый максимализм, драма, изобилие чувств и эмоций и стремление это все показать. Все с чем сталкиваются подростки в старшей школе. Я читала и думала: “Как хорошо, что это все позади”.  Я бы не хотела снова все это чувствовать и переживать. <br/><br/>Ах да, сеттинг не обычный, школа и город, где ЛГБТК+ победил, нетфликсу бы понравилось.",,,1,0
199020721,"Night Shift (Daydreamers, #1)",Annie Crown,"Crown, Annie",,"=""""","=""""",4,3.56,,Kindle Edition,283,2023,2023,2024/02/04,2024/02/03,,,read,"Я многого от книжки не ожидала, но она меня приятно удивила. Хотя начало было достаточно слабым. <br/><br/>Во-первых, мне нравится, как главная героиня видит свою жизнь как роман. Местами это ей мешает, но местами стратегия do it for the plot выигрывает. И все эти порнокнижки в порнокнижкам моя weak spot. Очень классно отрефлексировано мышление book girls <br/>Во-вторых, главный герой не маскулиный мачо. Вернее он мускулистый огромный спортсмен (естественно с огромным dick), но тем не менее очень чувствительный и местами не уверенный в себе.<br/>В-третьих, в spicy сценах студенты не ведут себя как порно-актеры. Все равно есть шутки, неловкость и что-то не выходит, это добавляет некую реалистичность не присущую жанру. Мне нравится <br/>В-четвертых, приземленный dirty talk, потому что ну правда, иногда это даже переборы <br/><br/>Еще из интересного, причиной miscommunication становится девушка, а не парень, что я давно не встречала.<br/><br/>На денек отличная книжка, чтобы отвлечься от реальности <br/><br/>",,,1,0
137944656,"Mistletoe and Mishigas (Teachers in Love, #2)",M.A. Wardell,"Wardell, M.A.",,"=""""","=""9798987787526""",0,4.02,M.A. Wardell,Kindle Edition,304,2023,2023,,2024/02/03,to-read,to-read (#81),to-read,,,,0,0
125836726,Jenshina,Erno Anni,"Anni, Erno",,"=""5604728837""","=""""",0,4.24,No Kidding Press,Paperback,80,2022,1988,2024/02/03,2024/02/01,,,read,,,,1,0
156714652,"The Best Kind of Forever (Riverside Reapers, #1)",Celeste Briars,"Briars, Celeste",,"=""""","=""""",0,3.11,,Kindle Edition,308,2023,2023,,2024/02/02,to-read,to-read (#80),to-read,,,,0,0
53344030,"Heartstopper: Volume Five (Heartstopper, #5)",Alice Oseman,"Oseman, Alice",,"=""1444957651""","=""9781444957655""",5,4.48,Hodder Children's Books,Paperback,336,2023,2023,2024/01/31,2023/12/10,,,read,,,,1,0
20618110,Solitaire,Alice Oseman,"Oseman, Alice",,"=""""","=""""",0,3.92,Harper Collins Children's Books UK,Paperback,392,2014,2014,,2024/01/31,to-read,to-read (#79),to-read,,,,0,0
125120424,"Heartstopper: Volume Six (Heartstopper, #6)",Alice Oseman,"Oseman, Alice",,"=""""","=""""",0,4.57,,,,,,,2024/01/31,to-read,to-read (#78),to-read,,,,0,0
25793458,Nick and Charlie,Alice Oseman,"Oseman, Alice",,"=""0008147876""","=""9780008147877""",5,4.15,HarperCollins Children's Books,ebook,120,2015,2015,2024/01/29,2024/01/13,,,read,,,,1,0
