Book Id,Title,Author,Author l-f,Additional Authors,ISBN,ISBN13,My Rating,Average Rating,Publisher,Binding,Number of Pages,Year Published,Original Publication Year,Date Read,Date Added,Bookshelves,Bookshelves with positions,Exclusive Shelf,My Review,Spoiler,Private Notes,Read Count,Owned Copies
62677236,Good for a Girl: A Woman Running in a Man's World,Lauren Fleshman,"Fleshman, Lauren",,"=""0593296796""","=""9780593296790""",5,4.47,Penguin Press,Kindle Edition,286,2023,2023,2024/08/13,2024/07/27,,,read,"1. Я начала эту книжку, чтобы она поддерживала мою мотивацию бегать. И она (вместе с десятками тиктоками) справилась<br/>2. Я ничего не знала про Лорен Флэшман. Я вообще не назову ни одного имя в легкой атлетике. Поэтому для меня балл очень много новой информации. Как девушка выросшая в спорте мне многое отзывалось, но из-за разницы командный/индивидуальный и игровой/неигровой кучу всего было о чем я даже не задумывалась.<br/>3. Я вообще считаю, что у меня достаточно открытые, прогрессивные взгляды на жизнь и спорт, я смотрю и поддерживаю женский спорт, нахожусь в контексте всяких исследований и борьбы за равноправие в спорте, поэтому какое было удивление, когда эта книга открыла для меня такие в общем-то очевидные истины, например что девушек и парней надо тренировать по-разному. Что до сих пор очень мало методик тренировок женщин согласно их физиологии. Что огромным корпорациям, в целом пофиг на поддержку спорта, они заинтересованы в женщинах в основном как в аудитории. <br/>Тут надо сделать отступление, что во мне очень глубоко сидят установки по типу: «просто отдавай 100% на каждой тренировке и добьешься лучшего результата», так что да, когда смотришь на эту историю со стороны понимаешь насколько все эти установки бред.<br/>4. Статистка… во-первых, статистика просто прекрасно вплетена в историю, что показывает читателю, что это не просто мнение автора, а, во-вторых, статистика меня ужасала. У 60% девочек выросших в спорте развивается РПП. Трансляция женского спорта составляет только 3% от всех спортивных событий.<br/>Мир может лучше!",,,1,0
41104077,Invisible Women: Data Bias in a World Designed for Men,Caroline Criado Pérez,"Pérez, Caroline Criado",,"=""1419729071""","=""9781419729072""",0,4.35,Abrams Press,Hardcover,448,2019,2019,,2024/08/07,to-read,to-read (#140),to-read,,,,0,0
44279110,My Year of Rest and Relaxation,Ottessa Moshfegh,"Moshfegh, Ottessa",,"=""0525522131""","=""9780525522133""",5,3.62,Penguin Books,Paperback,289,2019,2018,2024/08/04,2024/07/31,,,read,"Очень интересная книга.<br/><br/>Главная героиня - Белая молодая худая привилегированная гетеро цис девушка с траст фондом, домом оставшимся в наследство и апартаментами в Нью-Йорке, с высшим образованием и без долгов за него. <br/><br/>Местами она очень unlikeble. Потому что с таким набором ей достаточно сложно сопереживать.<br/>Но она в депрессии и решает лечить её кардинальным способом — с помощью различных медикаментов уйти в спячку на год.<br/><br/>Дальше спойлер:<br/>Для меня самым странным во всей этой странной книге было, что её план сработал. Не сразу, но глобально, она добилась того чего хотела «проснулась новым человеком». И именно в это мне не верилось, спи сколько угодно, но просыпаешься ты все равно самим собой и берешь с собой всегда себя. Решить такие проблемы с головой только сном, нууу… сомнительно ",true,,1,0
33018954,Моя гениальная подруга,Elena Ferrante,"Ferrante, Elena","Элена Ферранте, Ольга Ткаченко","=""""","=""""",0,4.05,Синдбад,Paperback,352,2016,2011,,2024/08/05,to-read,to-read (#139),to-read,,,,0,0
51587,The Sluts,Dennis Cooper,"Cooper, Dennis",,"=""0786716746""","=""9780786716746""",5,3.78,Carroll & Graf Publishers,Paperback,263,2005,2004,2024/07/31,2024/07/11,,,read,"Это самая fucked up книга, которую я читала. <br/>Если честно, не знаю как её оценивать.<br/><br/>Потому что это гениальная книга, она отлично написана, сама идея интересная, сложно оторваться, она вызывает кучу эмоций.<br/>Вот только эмоции, которая она вызывает это тошнота, стыд, смущение, отвращение.<br/>Если бы у этой книжки были TW вначале, они был шли первые страниц 10 наверно. Выделить главные: SA, Sexual violence, Injury detail, Murder, Physical abuse, Rape, Torture, Violence. Ну и как говорится the list goes on and on. <br/><br/>Я закрывала глаза, делала паузы чтобы отдышаться, напоминала, что это не правда, потому что такого графического описания я никогда и нигде не видела.<br/>А еще каждый раз, когда думаешь: «ну это п*здец, куда уж жестче» ты переворачиваешь страницу и там гораздо жестче!<br/><br/>Сама книга читается, как будто ты попал в кроличью нору в каком-то посте на реддите или треде в твиттере. Только тебе не надо искать доп инфу, она вся собрана вместе.<br/><br/>А еще она про то как легко в интернете создать видимость чего-то, преувеличить, соврать и ввести в замешательство. И если мы сейчас об этом все знаем, то когда она вышла в 2004 году это был очень свежий топик.<br/><br/><br/>Подводя итог: книга гениальная, никому не советую",,,1,0
36383990,Let Your Mind Run: A Memoir of Thinking My Way to Victory,Deena Kastor,"Kastor, Deena",Michelle Hamilton,"=""1524760773""","=""9781524760779""",0,4.36,Crown,Kindle Edition,296,2018,,,2024/07/27,to-read,to-read (#138),to-read,,,,0,0
32734333,"American King (New Camelot Trilogy, #3)",Sierra Simone,"Simone, Sierra",,"=""""","=""""",4,4.13,Sierra Simone,ebook,485,2017,2017,2024/07/25,2024/07/20,,,read,,,,1,0
32734331,"American Prince (New Camelot Trilogy, #2)",Sierra Simone,"Simone, Sierra",,"=""""","=""""",5,3.97,,ebook,330,2017,2017,2024/07/20,2024/07/09,,,read,"Какая же fucked up история. <br/>Я в восторге.<br/>Вторая книга тоооочно лучше.<br/>А еще так много смата!! Иногда несколько глав подряд, есть глава 30 страниц и все одна сцена. И он весь хороший. Ну 99%<br/><br/>Embery мой принц! Мое сердце разбивается от того как он всегда выбирает других вместо себя, как он делает и делает себе больно, для благополучия других. <br/><br/>Мне еще очень нравится, что с каждой новой книгой мы узнаем ситуации от других глаз. Полнота картины расширяется <br/><br/>В конце книги I’m literally sobbing, and I love it",,,1,0
23437156,"Six of Crows (Six of Crows, #1)",Leigh Bardugo,"Bardugo, Leigh",,"=""""","=""""",0,4.47,Henry Holt & Company,Hardcover,480,2015,2015,,2024/07/18,to-read,to-read (#137),to-read,,,,0,0
199355848,The Game Changer,Lana Ferguson,"Ferguson, Lana",,"=""0593816838""","=""9780593816837""",4,3.61,Berkley,Paperback,400,2024,2024,2024/07/18,2024/07/11,,,read,"Это очень милая книжка. Очень легкая. Главные герои все прекрасные. Главная героиня не наивная овечка, как я боялась, а сильная женщина, что очень круто. Главный герой не self centered, брат главной героини весь такой взрослый ребенок и очень goofy. Экс жена главного героя и её новая жена тоже любовь. Короче персонажи правда классные. <br/><br/>Но в книге никакой драмы. Вернее она настолько несущественная, что я реально ждала, что вот-вот что-то случится плохое, но нет.<br/>Самая большая драма там это терзания главного героя, вызванные тем, что его отец м*дак. Ну и noisy медиа и СМИ.<br/><br/>Но как легкий спортивный роман реально прикольно.<br/><br/>А да, spicy сцены надо подождать, но как они начинаются их прям много, я даже две точно читала по-диагонали, что для меня не свойственно. <br/>",,,1,0
124928062,"Cruel King (Royal Elite, #0)",Rina Kent,"Kent, Rina",,"=""""","=""""",0,3.90,"Blackthorn Books, LLC",Kindle Edition,360,2023,2019,,2024/07/17,to-read,to-read (#136),to-read,,,,0,0
76703559,"Throne of Glass (Throne of Glass, #1)",Sarah J. Maas,"Maas, Sarah J.",,"=""163973094X""","=""9781639730940""",0,4.18,Bloomsbury Publishing,Hardcover,406,2023,2012,,2024/07/17,to-read,to-read (#135),to-read,,,,0,0
56160395,With Teeth,Kristen Arnett,"Arnett, Kristen",,"=""0593191501""","=""9780593191507""",0,3.49,Riverhead,Hardcover,304,2021,2021,,2024/07/12,to-read,to-read (#134),to-read,,,,0,0
51054227,"Meet Cute Club (Sweet Rose, #1)",Jack Harbon,"Harbon, Jack",,"=""""","=""""",0,3.23,Jack Harbon,Kindle Edition,232,2020,2020,,2024/07/11,to-read,to-read (#133),to-read,,,,0,0
198563740,Experienced,Kate  Young,"Young, Kate",,"=""0143137980""","=""9780143137986""",0,4.00,Penguin Books,Paperback,384,2024,,,2024/07/11,to-read,to-read (#132),to-read,,,,0,0
58724599,"A Taste of Gold and Iron (Mahisti Dynasty, #1)",Alexandra Rowland,"Rowland, Alexandra",,"=""1250800382""","=""9781250800381""",0,4.05,Tor Books,Hardcover,512,2022,2022,,2024/07/11,to-read,to-read (#131),to-read,,,,0,0
54508798,"The Guncle (The Guncle, #1)",Steven  Rowley,"Rowley, Steven",,"=""0525542280""","=""9780525542285""",0,4.13,G.P. Putnam's Sons,Hardcover,326,2021,2021,,2024/07/11,to-read,to-read (#130),to-read,,,,0,0
39700896,Pennsylvania Station,Patrick E. Horrigan,"Horrigan, Patrick E.",,"=""""","=""""",0,3.93,Lethe Press,Kindle Edition,272,2018,,,2024/07/11,to-read,to-read (#129),to-read,,,,0,0
49203397,These Violent Delights,Micah Nemerever,"Nemerever, Micah",,"=""0062963635""","=""9780062963635""",0,3.96,Harper,Hardcover,460,2020,2020,,2024/07/11,to-read,to-read (#128),to-read,,,,0,0
53968472,"Yes, Daddy",Jonathan Parks-Ramage,"Parks-Ramage, Jonathan",,"=""0358447712""","=""9780358447719""",0,3.58,Harper,Hardcover,282,2021,2021,,2024/07/11,to-read,to-read (#127),to-read,,,,0,0
32740869,"American Queen (New Camelot Trilogy, #1)",Sierra Simone,"Simone, Sierra",,"=""""","=""""",4,3.83,,Kindle Edition,393,2016,2016,2024/07/09,2024/07/05,,,read,"So this is basically just porn. good porn, though <br/><br/>Короче, вся книга это просто становление отношений персонажей. And I’m not mad about it, потому что throuple это всегда сложно, начиная с того, чтобы персонажам понять, что это то чего они хотят, заканчивая навигацией втроем ",,,1,0
154986013,"Curvy Girl Summer (Curve, #1)",Danielle Allen,"Allen, Danielle",,"=""1250331048""","=""9781250331045""",0,4.32,Bramble,Paperback,368,2024,2024,,2024/07/08,to-read,to-read (#126),to-read,,,,0,0
17158532,"Kings Rising (Captive Prince, #3)",C.S. Pacat,"Pacat, C.S.",,"=""174348495X""","=""9781743484951""",4,4.43,Penguin Group Australia,ebook,385,2016,2016,2024/07/04,2024/06/29,,,read,,,,1,0
9898505,"Автостопом по Галактике. Ресторан ""У конца вселенной""",Douglas Adams,"Adams, Douglas",Дуглас Адамс,"=""5170324588""","=""9785170324583""",4,4.20,АСТ,Hardcover,352,2005,1980,2024/03/31,2024/03/26,,,read,"Классика жанра.<br/><br/>«- Ваш бог поместил посреди сада яблоню и сказал: «Делайте, ребята, что хотите, но яблок не ешьте». Стало им жутко интересно, съели они яблоко, а бог выскочил из-за куста: «Ага! Попались!» Но если б они и не съели яблоко, им все равно бы несдобровать.<br/>- Почему это?<br/>- Имея дело с типом, который любит оставлять на тротуаре кирпич, прикрытый шляпой, нужно отдавать себе отчет - такие не остановятся на полпути. Они своего до-бьются.»",,,1,0
60664970,Кремулятор,Sasha Filipenko,"Filipenko, Sasha",Саша Филипенко,"=""""","=""""",4,4.35,Время,Hardcover,212,2022,,2024/06/29,2024/06/10,,,read,,,,1,0
49977811,Swimming in the Dark,Tomasz Jedrowski,"Jedrowski, Tomasz",,"=""006289000X""","=""9780062890009""",0,4.25,William Morrow,Hardcover,191,2020,2020,,2024/06/29,to-read,to-read (#125),to-read,,,,0,0
17158513,"Captive Prince: Volume Two (Captive Prince, #2)",C.S. Pacat,"Pacat, C.S.",,"=""""","=""""",5,4.37,,ebook,216,2012,2013,2024/06/29,2024/06/26,,,read,"Вторая книга яяяяявно лучше первой!<br/>Во-первых, раскрываются персонажи наконец. <br/>Во-вторых, меньше всяких моментов, которые бы попали под TW. <br/>В-третьих, наконец spicy!",,,1,0
59521680,"Плененный принц  (Captive Prince, #1)",C.S. Pacat,"Pacat, C.S.",К.С. Пакат,"=""5604611905""","=""9785604611906""",3,3.80,Popcorn Books,Paperback,256,2022,2013,2024/06/26,2024/06/23,,,read,"Окей, это не справедливо. Вся книжка это только ЗАВЯЗКА истории, так они меня этим разозлили, я ждала какой-то развязки, enemies должна были стать lovers, но нет! Ну зачем так делать. Книга же не большая, могли объединить со следующими.<br/><br/>Но если отбросить это. История главных героев видимо очень slow burn будет. И окей, я жду что они раскроется оба как персонажи в следующих книгах, в этих же они выглядят ну очень плоскими.<br/><br/>И еще! Почему в начале книги нет триггер ворнингов. Потому что тут SA, sex slavery, педофилия, forced sex, вуайеризм, принуждение и еще много чего что подается как нормальные обычие короловеской свиты. Я абзацы описывающие изнасилования просто пропускала.<br/><br/>P.S. Кудос переводчикам, очень классно сделано, учитывая что текст так написан, что его правда сложно перевести адекватно",,,1,0
126427038,"Reckless Heart (Starlight Cove, #4)",Brighton Walsh,"Walsh, Brighton",,"=""1685180302""","=""9781685180300""",0,3.97,"Bright Publishing, LLC",Kindle Edition,334,2023,2023,,2024/06/26,to-read,to-read (#124),to-read,,,,0,0
55648820,Seven Days in June,Tia Williams,"Williams, Tia",,"=""""","=""""",0,4.01,Grand Central Publishing,Hardcover,336,2021,2021,,2024/06/23,to-read,to-read (#123),to-read,,,,0,0
49259788,The Summer of Broken Rules,K.L. Walther,"Walther, K.L.",,"=""1728210291""","=""9781728210292""",5,3.90,Sourcebooks Fire,Paperback,359,2021,2021,2024/06/22,2023/06/03,,,read,"Это просто очень классный летний роман, к которому в реальной жизни у меня скорее всего было бы много вопросов, но на бумаге это выглядит прекрасно. <br/>Очень много поп-культурных референсов, а я очень люблю такое.<br/>Ну и заканчивала я этот роман плача на лавочке в парке. <br/>В настроение попал на 100%",,,1,0
60591976,Seeking Two Lovers,Lynn  Burke,"Burke, Lynn",,"=""""","=""""",0,4.06,Author Lynn Burke,ebook,,2022,,,2024/06/20,to-read,to-read (#122),to-read,,,,0,0
195820807,"Just for the Summer (Part of Your World, #3)",Abby Jimenez,"Jimenez, Abby",,"=""1538704439""","=""9781538704431""",0,4.38,Forever,Paperback,432,2024,2024,,2024/06/16,to-read,to-read (#121),to-read,,,,0,0
61718053,Happy Place,Emily Henry,"Henry, Emily",,"=""0593441273""","=""9780593441275""",0,3.97,Berkley,Hardcover,400,2023,2023,,2024/06/16,to-read,to-read (#120),to-read,,,,0,0
52867387,Beach Read,Emily Henry,"Henry, Emily",,"=""""","=""""",0,3.99,Berkley,Paperback,400,2020,2020,,2024/06/16,to-read,to-read (#119),to-read,,,,0,0
175997488,Picking Peaches (Rosewood),Ansley B. Calloway,"Calloway, Ansley B.",,"=""""","=""""",0,3.55,,Kindle Edition,209,2023,,,2024/06/16,to-read,to-read (#118),to-read,,,,0,0
121388170,Право на гнев: Почему в XXI веке воспитание детей и домашние обязанности до сих пор лежат на женщинах (Есть смысл) (Russian Edition),Дарси Локман,"Локман, Дарси",Darcy Lockman,"=""""","=""""",0,4.00,Help Needed,Kindle Edition,394,2022,,,2023/09/05,"currently-reading, did-not-finish","currently-reading (#2), did-not-finish (#1)",currently-reading,,,,1,0
190349388,Его последние дни (Russian Edition),Рагим Джафаров,"Джафаров, Рагим",,"=""5001398568""","=""9785001398561""",4,4.04,Альпина нон-фикшн,Kindle Edition,0,2022,,2024/06/05,2024/04/09,,,read,,,,1,0
198563757,Everything We Never Said,Sloan Harlow,"Harlow, Sloan",,"=""0593855728""","=""9780593855720""",0,3.84,Penguin Young Readers Group,Paperback,320,2024,2024,,2024/06/05,to-read,to-read (#117),to-read,,,,0,0
198247815,"Mother Faker (The Momcoms, #1)",Brittanee Nicole,"Nicole, Brittanee",,"=""""","=""""",0,4.18,,Kindle Edition,340,2024,2024,,2024/06/02,to-read,to-read (#116),to-read,,,,0,0
212097165,"Чем мы занимались, пока вы учили нас жить",Иван Бевз,"Бевз, Иван",,"=""5001676118""","=""9785001676119""",5,4.04,САМОКАТ,Kindle Edition,241,2024,,2024/05/10,2024/05/04,,,read,"Как мне не нравится читать о школе в взрослом возрасте. Наверно, это из-за излишней романтизации этого периода. Тут такого нет, вернее нет в классическом понимания. Поэтому, мне понравилось. <br/><br/>После прочтения первой части у меня для неё появилось точное описание в голове - boy, who picked in high school. <br/><br/>Героиня второй части мне больше импонирует по итогу. Наверно, это потому что у неё в отличии от героя первой части есть развития героя. Она меняется, что-то переосмысляет на уровне личных отношений, она более человечна, «мальчик со злыми глазами» же жадный до власти, не удавшийся диктатор, который никакие выводы не делает, а лишь жалеет о прошлом, которое не может вернуть. <br/><br/>Я все думала для кого эта книга. Потому что она веет young adult если читать её с точки зрения сюжета и каких-то поднятых проблем. Но если вчитываться в первые абзацы глав, где идут философские рассуждения, то как будто бы немного глубже все. <br/>Конечно, местами теряется правдоподобность как событий происходящих в школе, так и слишком уж разумных и глубоких мыслей главных героев. Но это не отталкивает совсем, а как будто просто гиперболизирует происходящее. <br/>Второй поинт, почему это не young adult, это что действие происходят старших классах в нулевых. А как будто те, кто учился в то время уже явно не young(простите) adult. (Это я про жанровую литературу, так мы с вами супер young). Все отсылки современным старшеклассникам как будто и не будут понятны. <br/><br/>Но в целом, очень бодренько, задорненько и хорошо написано! Язык очень понравился.",,,1,0
60304369,Сезон отравленных плодов,Вера Богданова,"Богданова, Вера",,"=""5171468079""","=""9785171468071""",5,4.21,АСТ: Редакция Елены Шубиной,Hardcover,348,2022,,2024/05/31,2024/02/15,,,read,"Вот уж действительно роман поколения.<br/>Я младше героев книги, но почему-то они кажутся мне очень знакомыми, ребята из соседнего дома. Не удивлюсь, если похожие вещи переживали мои знакомые. <br/><br/>Это история, как из травмированных детей, вырастают травмированные взрослые. И как сложно это предотвратить. Травма поколения, все как у Петрановской.<br/>",,,1,0
203370592,His to Break (Wasteland Temptations #3),E.V. Olsen,"Olsen, E.V.",,"=""""","=""""",2,3.47,,Kindle Edition,54,2024,2024,2024/05/30,2024/05/30,,,read,"Straight PWP here. Well not straight, it’s MM. <br/>Not the worst, not the best either",,,1,0
203510383,"Stand and Defend (Lakes Hockey, #4)",Sloane St. James,"James, Sloane St.",,"=""""","=""""",0,4.28,,Kindle Edition,458,2024,2024,,2024/05/26,to-read,to-read (#115),to-read,,,,0,0
35223351,День опричника,Vladimir Sorokin,"Sorokin, Vladimir",Владимир Сорокин,"=""5171024480""","=""9785171024482""",0,3.74,АСТ,Hardcover,240,2017,2006,,2024/05/26,to-read,to-read (#114),to-read,,,,0,0
